<?xml version="1.0" encoding="UTF-8" ?>
<books 	xmlns:xsi="http://www.w3.org/2001/XMLSchema-instance"
		xsi:schemaLocation="books.xsd" >
  <book id="10">
    <author>Author 1</author>
    <title>Some title here</title>
    <price>23.00</price>
    <publish_date>1920-01-01</publish_date>
    <virtual-library-path>D:\java.exe</virtual-library-path>
  </book>
    <book id="20">
    <author>Author 2</author>
    <title>Another title here</title>
    <price>30.00</price>
    <publish_date>1990-01-01</publish_date>
    <virtual-library-path>D:\program files\Java\java.exe</virtual-library-path>
  </book>
</books>